{
  "id": "urn:receipt:ok-001",
  "issued_at": "2025-09-08T10:00:00Z",
  "model_version": "vendor:model@2025-09-01",
  "policy_version": "trust:standard@1.0",
  "policy_hash": "sha256:aaaaaaaaaaaaaaaaaaaaaaaaaaaaaaaaaaaaaaaaaaaaaaaaaaaaaaaaaaaaaaaa",
  "input_hash": "sha256:bbbbbbbbbbbbbbbbbbbbbbbbbbbbbbbbbbbbbbbbbbbbbbbbbbbbbbbbbbbbbbbb",
  "output_hash": "sha256:cccccccccccccccccccccccccccccccccccccccccccccccccccccccccccccccc",
  "timestamp": "2025-09-08T10:00:05Z",
  "proof_refs": [
    {
      "type": "eth_tx",
      "chain_id": 11155111,
      "txid": "0x69d05d76bbe43f296ddf3742fa38f0730be09008525770d7b26003f791eaa0d6"
    }
  ],
  "trustscore": 95,
  "signature": "did:web:example.org#k1 sig..."
}
